{
	"scene_id": "01.01.01",
	"book": 1,
	"chapter": 1,
	"scene": 1,
	"title": "Another Monday Morning at the Office",
	"summary": "Jake follows his usual Monday routine, commuting to the corporate office, greeting coworkers, and sharing an elevator ride before the mysterious System message knocks him out.",
	"source_file": "chapters/Book 01 - PH/0001_Chapter_1_Another_Monday_Morning.md",
	"start_line": 1,
	"end_line": 83,
	"pov": "Jake",
	"mood": [
		"mundane",
		"routine",
		"foreshadowing"
	],
	"time_tag": [
		"Day 0",
		"pre-system",
		"Monday morning"
	],
	"chunked_with": "Manual review",
	"characters": {
		"Jake": {
			"present": "explicit",
			"notes": "Financial analyst, soon-to-be System initiate."
		},
		"Joanna": {
			"present": "explicit",
			"notes": "Talkative receptionist who shares weekend stories."
		},
		"Jacob": {
			"present": "explicit",
			"notes": "Jake's sociable supervisor and friend."
		},
		"Bertram": {
			"present": "explicit",
			"notes": "Jacob's bodyguard-like companion."
		},
		"Caroline": {
			"present": "explicit",
			"notes": "Coworker from HR; Jake's unspoken crush."
		},
		"Mike": {
			"present": "explicit",
			"notes": "Joanna's husband, seen in the elevator."
		}
	},
	"events": {
		"level_ups": [],
		"tier_changes": [],
		"loot": [],
		"titles_gained": []
	},
	"locations": [
		"Jake's apartment",
		"City traffic",
		"Corporate office lobby",
		"Fourteenth-floor open office",
		"Elevator"
	],
	"tags": [
		"office_life",
		"character_intro",
		"system_foreshadowing",
		"reflection"
	],
	"skills_gained": []
}